brewery,beer_name,beer_image,price_euro,style,description,abv,volume,product_url
ÅBEN,Mumbo Jumbo #6,"https://webshop.aabenbryg.dk/cdn/shop/files/437.MumboJumbo_6.jpg?v=1745848920&width=533,https://webshop.aabenbryg.dk/cdn/shop/files/DSCF4984.jpg?v=1745849031&width=533",34.39,Sour,"Part of the Mumbo Jumbo series, this sour fruited gose combines the best of fruit and summer. Inspired by the classic Danish dessert Rødgrød, this deep crimson beer bursts with ripe strawberries, tangy rhubarb, and a smooth hint of vanilla.",,,
ÅBEN,Afterschool Club,https://webshop.aabenbryg.dk/cdn/shop/files/428._Afterschool_Club.jpg?v=1745847567&width=533,29.51,IPA,"Discover the bold flavors of our New England IPA, brewed in collaboration with Stigbergets, Bale Breaker, Yakima Chief Hops, and White Labs. This unpasteurised and unfiltered IPA features Loftus Ranch hops for a rich, full-bodied experience. Expect juicy stone fruit notes, creamy pineapple, and vibrant peachy esters from WLP008 yeast.",,,
ÅBEN,Citrea,"https://webshop.aabenbryg.dk/cdn/shop/files/138.Citreae.jpg?v=1743678193&width=533,https://webshop.aabenbryg.dk/cdn/shop/files/Hero_Image_1080x1435_px_5c1e2440-3a9e-4190-b11c-1a0840642c4b.jpg?v=1744015229&width=533",29.51,Sour,"Bright, energetic and citrusy, this Gose is packed full of blood orange, lime and lemon. Finished with a kiss of salt for fullness and to complement the beers fast acidity.",4.50%,44,https://webshop.aabenbryg.dk/products/https-webshop-aabenbryg-dk-products-citrea
ÅBEN,Stolen Red Berries / 33 cl.,"https://webshop.aabenbryg.dk/cdn/shop/files/100._Stolen_Redberries.jpg?v=1739880666&width=533,https://webshop.aabenbryg.dk/cdn/shop/files/StolenRedBerries.jpg?v=1739880666&width=533",24.88,Sour,"Stolen Red Berries is the first member of our Stolen series, consisting of soured wheat beers. We went fruity on this one by adding all our favourite red berries: raspberry, black cherries, black currant, red currant and blackberry in the fermentor. All the fruits are 100% natural with nothing added to them. The beer is tart and refreshing with a beautiful pink foam and is a true thirst-quencher for the hot summer days.",4.50%,33,https://webshop.aabenbryg.dk/products/stolen-red-berries-33-cl
ÅBEN,A Bit Chilly,https://webshop.aabenbryg.dk/cdn/shop/files/419ABitChilly.jpg?v=1736350962&width=533,31.66,Dark Ale,"Brewed to celebrate Baltic Porter Day 2025; A Bit Chilly is brewed using a complex blend of malts and focused lager fermentation. You can expect dark winter fruits, molasses and rich chocolate before being greeted with a touch of smoke carried by a cold sea breeze.",9.00%,44,https://webshop.aabenbryg.dk/products/a-bit-chilly
ÅBEN,Y,https://webshop.aabenbryg.dk/cdn/shop/files/390._Y.jpg?v=1735900088&width=533,18.29,IPA,Awarded DK's best non-alcoholic beer. ÅBEN's first step into the world of non-alcoholic brewing has what you would expect from a modern IPA but with a modest ABV and no compromise on flavour.,,,
ÅBEN,Short,https://webshop.aabenbryg.dk/cdn/shop/files/412.Short.jpg?v=1730471458&width=533,6.72,Stout,"A stout that's not short on flavor, brewed with a carefully selected blend of dark brown and crystal malts. Chocolatey and smooth with a gentle hint of roasted malt character. Simple and delicious.",5.20%,44,https://webshop.aabenbryg.dk/products/short
ÅBEN,Big Bang Barley Wine 2024,"https://webshop.aabenbryg.dk/cdn/shop/files/346.BigBangBarleyWine2024.jpg?v=1728474048&width=533,https://webshop.aabenbryg.dk/cdn/shop/files/DSCF4377.jpg?v=1728474935&width=533",8.46,Barley Wine,This American Barley Wine is the 3rd in ÅBEN's line of vintage Barley Wines and the last beer to be brewed at ÅBEN brewery in 2023. It is a beautifully clear and copper coloured beer with a delicate bitterness and hoppy aroma.,,,
ÅBEN,Birch 0.33 CL,"https://webshop.aabenbryg.dk/cdn/shop/files/Birch_0.33.jpg?v=1718961887&width=533,https://webshop.aabenbryg.dk/cdn/shop/files/Birch_39ea8e47-dadc-4ce1-bb24-76b43c4b4cd3.jpg?v=1705570610&width=533",4.71,Pilsner,"A clean and zippy pilsner with layered additions of some of our favorite German hops. Foamy, clean and crushable. Now in a small 33 CL can.",4.80%,33,https://webshop.aabenbryg.dk/products/birch-0-33-cl
ÅBEN,Big Bang Barley Wine 2023,"https://webshop.aabenbryg.dk/cdn/shop/files/260.BigBangBarleyWine23.jpg?v=1700558849&width=533,https://webshop.aabenbryg.dk/cdn/shop/files/BBB23.jpg?v=1700558881&width=533",8.46,Barley Wine,This American Barley Wine is the 2nd in ÅBEN's line of Vintage Barley Wines and the last beer to be brewed at the new ÅBEN brewery in 2022. It is a beautifully clear and copper coloured beer with a delicate bitterness and hoppy aroma.,,,
ÅBEN,Larch,"https://webshop.aabenbryg.dk/cdn/shop/products/258.Larch.jpg?v=1677225306&width=533,https://webshop.aabenbryg.dk/cdn/shop/files/Larch_4668db40-72bf-46b1-bf3f-dbc4472e7168.jpg?v=1705570655&width=533",6.06,Lager,Our take on a Classic Vienna lager for everyday enjoyment. Brewed with a carefully blended selection of malts and finished with Mittelfrüh hops.,4.90%,44,https://webshop.aabenbryg.dk/products/larch-vienna-lager
ÅBEN,Fluff,"https://webshop.aabenbryg.dk/cdn/shop/products/238.Fluff_1.jpg?v=1682329711&width=533,https://webshop.aabenbryg.dk/cdn/shop/files/Fluff_e04fca14-70a0-4b53-84d1-372086a4d564.jpg?v=1705570707&width=533",6.06,Weissbier,Fluff is a decocted bright yellow and fluffy wheat beer oozing with delicate esters of banana and clove.,5.20%,44,https://webshop.aabenbryg.dk/products/fluff-weissbier
ÅBEN,Birch,"https://webshop.aabenbryg.dk/cdn/shop/products/257.Birch.jpg?v=1676468050&width=533,https://webshop.aabenbryg.dk/cdn/shop/files/Birch_39ea8e47-dadc-4ce1-bb24-76b43c4b4cd3.jpg?v=1705570610&width=533",6.06,Pilsner,"A clean and zippy pilsner with layered additions of some of our favorite German hops. Foamy, clean and crushable.",4.80%,44,https://webshop.aabenbryg.dk/products/birch-german-pilsner
ÅBEN,Mumbo Jumbo #1,"https://webshop.aabenbryg.dk/cdn/shop/products/263.MumboJumbo_PassionFruitsGuavaRaspberry.jpg?v=1675090430&width=533,https://webshop.aabenbryg.dk/cdn/shop/files/MumboJumbo_1.jpg?v=1705570553&width=533",9.15,Sour,"This full bodied, lightly sour and salty gose is brewed with passion fruit, guava & raspberry. This beer is part of the big fruited gose series; Mumbo Jumbo. Every Mumbo Jumbo is made with heaps and heaps of fruit.",6%,44,https://webshop.aabenbryg.dk/products/passion-fruit-guava-raspberry-mumbo-jumbo-fruited
ÅBEN,Occulation BA Rum,https://webshop.aabenbryg.dk/cdn/shop/products/172.OcculationBA.W.Rum.jpg?v=1671617621&width=533,11.43,Stout,"Our Occulation series consists of 4 beers, which all derive from a brew of Imperial stout we did back in 2019. Since then we barrel aged half of that brew into 4 different oak barrels. This one was barrel aged in an old barrel where there used to be Rum in which provides the beer with a very special aroma. Occulation has been barrel aged for 274 days across 9 month and hits 10.5%.",10.50%,33,https://webshop.aabenbryg.dk/products/copy-of-occulation-barrel-aged-rum
ÅBEN,Big Bang Barley Wine 2022,"https://webshop.aabenbryg.dk/cdn/shop/products/215.BigBangBarleyWineVintage2022_f5bc34c7-446c-4a3a-a4f5-40b4b9abfa17.jpg?v=1666015782&width=533,https://webshop.aabenbryg.dk/cdn/shop/products/bigbangbarleywine.jpg?v=1666015782&width=533",8.46,Barley Wine,Big Bang Barley Wine is an American Barley Wine brewed during the summer of 2022. It is a rare release and one of the final beers made at the original ÅBEN brewery in Kolding. It is a beautifully clear and copper coloured beer with a delicate bitterness and hoppy aroma.,,,
ÅBEN,Stolen Red Berries,"https://webshop.aabenbryg.dk/cdn/shop/products/100.StolenRedBerries_78732153-7ac2-411c-ad59-db4dca3d67c9.jpg?v=1666015375&width=533,https://webshop.aabenbryg.dk/cdn/shop/files/StolenRedBerries.jpg?v=1739880666&width=533",7.94,Sour,"Stolen Red Berries is the first member of our Stolen series, consisting of soured wheat beers. We went fruity on this one by adding all our favourite red berries: raspberry, black cherries, black currant, red currant and blackberry in the fermentor. All the fruits are 100% natural with nothing added to them. The beer is tart and refreshing with a beautiful pink foam and is a true thirst-quencher for the hot summer days.",4.50%,44,https://webshop.aabenbryg.dk/products/stolen-red-berries-1
ÅBEN,Bryg 61,"https://webshop.aabenbryg.dk/cdn/shop/files/61.Bryg61_Updated.jpg?v=1718183362&width=533,https://webshop.aabenbryg.dk/cdn/shop/files/Bryg61_b4bcec30-d798-44fe-bde6-7abbfc2e1cd3.jpg?v=1718183360&width=533",6.72,IPA,"Our first ever beer - which has now become our signature beer. It is called Bryg nr. 61 (brew no. 61), as it took 60 attempts before ending up with the right recipe. It is a fruity and hazy New England Pale Ale made primarily with Citra and Mosaic. Only very modest bitterness but high aroma of exotic fruits. Delicious for a summer day or a drink in the bar.",5.50%,44,https://webshop.aabenbryg.dk/products/bryg-61-new-england-ipa
ÅBEN,Diffuse Light,"https://webshop.aabenbryg.dk/cdn/shop/files/181.DiffuseLight.jpg?v=1695123214&width=533,https://webshop.aabenbryg.dk/cdn/shop/files/DiffuseLight.jpg?v=1705570349&width=533",8.46,Double IPA,"Diffuse Light is part of our beer series Reflection consisting of New England IPAs. All beers in the series are based on the same malt profile but with a different hop composition. With the use of a new yeast strain that enhances esters production, the beers have been fermented at a slightly higher temperature. All of which provides more body and more of that exotic fruit aroma and taste to the beer.",8.00%,44,https://webshop.aabenbryg.dk/products/diffuse-light?_pos=1&_sid=f03b26933&_ss=r
ÅBEN,Specular,"https://webshop.aabenbryg.dk/cdn/shop/products/182.Specular_18146dcd-35a9-4dc3-b96e-f68e5609e59b.jpg?v=1666014524&width=533,https://webshop.aabenbryg.dk/cdn/shop/files/Hero_Image_1080x1435_px.jpg?v=1738315741&width=533",9.15,IPA,Specular --- a returning brew from our Reflection series of New England IPAs. The beers in this series are based on the same malt profile but with a different hop composition.,10.00%,44,https://webshop.aabenbryg.dk/products/specular?_pos=1&_sid=cbf23f0d2&_ss=r
ÅBEN,Circle,"https://webshop.aabenbryg.dk/cdn/shop/files/136.Circle.jpg?v=1700559294&width=533,https://webshop.aabenbryg.dk/cdn/shop/files/Circle.jpg?v=1705570227&width=533",6.45,IPA,"Circle is one of ÅBENs core beers. It is a light, fruity and easy-to-drink session IPA at 4.7%. Circle is perfect option if you are looking for something light and refreshing yet full of flavour.",4.70%,44,https://webshop.aabenbryg.dk/products/circle